[
  {
    "id": "sentry-84294394",
    "title": "RateLimitError: Error code: 429 - {'error': {'message': 'You exceeded your current quota, please check your plan and billing details. For more information on this error, read the docs: https://platform.openai.com/docs/guides/error-codes/api-errors.', 'type': 'insuffici...",
    "area": "frontend",
    "owner": "dashboard",
    "severity": "medium",
    "frequency": 38,
    "lastSeen": "2026-01-11T15:22:36.915848Z",
    "firstSeen": "2025-12-20T15:37:54.254173Z",
    "evidence": {
      "sentryUrl": "https://consultaion.sentry.io/issues/84294394/",
      "stack": [],
      "breadcrumbs": []
    },
    "expectedFix": {
      "kind": "guardrail",
      "filesHint": [
        "/debates"
      ],
      "notes": "Auto-classified: medium severity guardrail in dashboard"
    }
  },
  {
    "id": "sentry-84294399",
    "title": "Seat architect failed in round 1: Circuit breaker open for openrouter/openai/gpt-4o-mini (error_rate=100.00%)",
    "area": "frontend",
    "owner": "dashboard",
    "severity": "medium",
    "frequency": 20,
    "lastSeen": "2026-01-11T15:22:40.349778Z",
    "firstSeen": "2025-12-20T15:38:01.224111Z",
    "evidence": {
      "sentryUrl": "https://consultaion.sentry.io/issues/84294399/",
      "stack": [],
      "breadcrumbs": []
    },
    "expectedFix": {
      "kind": "guardrail",
      "filesHint": [
        "/debates"
      ],
      "notes": "Auto-classified: medium severity guardrail in dashboard"
    }
  },
  {
    "id": "sentry-84294390",
    "title": "AppError",
    "area": "frontend",
    "owner": "dashboard",
    "severity": "medium",
    "frequency": 16,
    "lastSeen": "2026-01-10T11:13:19.209586Z",
    "firstSeen": "2025-12-20T15:37:50.940449Z",
    "evidence": {
      "sentryUrl": "https://consultaion.sentry.io/issues/84294390/",
      "stack": [],
      "breadcrumbs": []
    },
    "expectedFix": {
      "kind": "guardrail",
      "filesHint": [
        "/debates/{debate_id}/timeline"
      ],
      "notes": "Auto-classified: medium severity guardrail in dashboard"
    }
  },
  {
    "id": "sentry-84294401",
    "title": "LLM call failed for role Risk Officer: LLM call failed for role Risk Officer: litellm.BadRequestError: AnthropicException - {\"type\":\"error\",\"error\":{\"type\":\"invalid_request_error\",\"message\":\"Your credit balance is too low to access the Anthropic API. Pl...",
    "area": "frontend",
    "owner": "dashboard",
    "severity": "medium",
    "frequency": 15,
    "lastSeen": "2026-01-11T15:10:04.732447Z",
    "firstSeen": "2025-12-20T15:38:01.217024Z",
    "evidence": {
      "sentryUrl": "https://consultaion.sentry.io/issues/84294401/",
      "stack": [],
      "breadcrumbs": []
    },
    "expectedFix": {
      "kind": "guardrail",
      "filesHint": [
        "/debates"
      ],
      "notes": "Auto-classified: medium severity guardrail in dashboard"
    }
  },
  {
    "id": "sentry-87773263",
    "title": "Circuit breaker OPENED for openrouter/anthropic/claude-3-5-sonnet-20240620 (error_rate=100.00% threshold=50.00%)",
    "area": "frontend",
    "owner": "dashboard",
    "severity": "medium",
    "frequency": 2,
    "lastSeen": "2026-01-11T15:22:39.340455Z",
    "firstSeen": "2026-01-11T15:21:08.262245Z",
    "evidence": {
      "sentryUrl": "https://consultaion.sentry.io/issues/87773263/",
      "stack": [],
      "breadcrumbs": []
    },
    "expectedFix": {
      "kind": "guardrail",
      "filesHint": [
        "/debates"
      ],
      "notes": "Auto-classified: medium severity guardrail in dashboard"
    }
  },
  {
    "id": "sentry-87773292",
    "title": "Circuit breaker OPENED for openrouter/openai/gpt-4o-mini (error_rate=100.00% threshold=50.00%)",
    "area": "frontend",
    "owner": "dashboard",
    "severity": "medium",
    "frequency": 2,
    "lastSeen": "2026-01-11T15:22:36.925253Z",
    "firstSeen": "2026-01-11T15:21:15.450267Z",
    "evidence": {
      "sentryUrl": "https://consultaion.sentry.io/issues/87773292/",
      "stack": [],
      "breadcrumbs": []
    },
    "expectedFix": {
      "kind": "guardrail",
      "filesHint": [
        "/debates"
      ],
      "notes": "Auto-classified: medium severity guardrail in dashboard"
    }
  }
]