[
  {
    "id": "sentry-125060432",
    "title": "Error: Request failed: 500",
    "area": "frontend",
    "owner": "dashboard",
    "severity": "medium",
    "frequency": 2,
    "lastSeen": "2026-06-04T11:21:59.554000Z",
    "firstSeen": "2026-06-04T10:56:50.516000Z",
    "evidence": {
      "sentryUrl": "https://consultaion.sentry.io/issues/125060432/",
      "stack": [],
      "breadcrumbs": []
    },
    "expectedFix": {
      "kind": "guardrail",
      "filesHint": [
        "Page Server Component (/(app)/analytics)"
      ],
      "notes": "Auto-classified: medium severity guardrail in dashboard"
    }
  }
]